pub_date	title	type	venue	authors	excerpt	citation	url_slug	paper_url	slides_url	code_url	report_url
2018-06-10	Beaver: Towards a Declarative Schema Mapping	Workshop	HILDA 2018 @ SIGMOD	"Zhongjun Jin, <strong>Christopher Baik</strong>, Michael J. Cafarella and H. V. Jagadish"			beaver-hilda	https://dl.acm.org/citation.cfm?id=3209902
2019-01-16	Demonstration of a Multiresolution Schema Mapping System	Demo	CIDR 2019	"Zhongjun Jin, <strong>Christopher Baik</strong>, Michael J. Cafarella, H. V. Jagadish, and Yuze Lou"			beaver-cidr	http://cidrdb.org/cidr2019/papers/p9-jin-cidr19.pdf
2019-04-08	Bridging the Semantic Gap with SQL Query Logs in Natural Language Interfaces to Databases	Research	ICDE 2019	"<strong>Christopher Baik</strong>, H. V. Jagadish, and Yunyao Li"			templar-icde	https://ieeexplore.ieee.org/document/8731607	/assets/files/templar_icde2019_slides.pdf	https://github.com/umich-dbgroup/templar
2019-08-30	Disambiguating Natural Language Queries with Tuples	Workshop	CAST 2019 @ VLDB	"<strong>Christopher Baik</strong>, Zhongjun Jin, and Michael Cafarella"			litmus-cast	/assets/files/litmus_cast2019.pdf	/assets/files/litmus_cast2019_slides.pdf	https://github.com/umich-dbgroup/litmus
2020-01-12	Fragment-Driven Natural Language Interaction with Databases	Abstract	CIDR 2020	"<strong>Christopher Baik</strong>"			fragsql-cidr	/assets/files/fragsql_cidr2020.pdf
2020-01-12	Constructing Expressive Relational Queries with Dual-Specification Synthesis	Research	CIDR 2020	"<strong>Christopher Baik</strong>, Zhongjun Jin, Michael Cafarella, and H. V. Jagadish"			duoquest-cidr	/assets/files/duoquest_cidr2020.pdf	/assets/files/duoquest_cidr2020_novideo.pptx	https://github.com/umich-dbgroup/duoquest
2020-06-14	Duoquest: A Dual-Specification System for Expressive SQL Queries	Research	SIGMOD 2020	"<strong>Christopher Baik</strong>, Zhongjun Jin, Michael Cafarella, and H. V. Jagadish"			duoquest-sigmod			https://github.com/umich-dbgroup/duoquest	https://arxiv.org/abs/2003.07438